{"$schema":"../../../../schema/award-results.schema.json","schemaVersion":1,"awardBodyId":"golden-globes","ceremony":{"year":1994,"number":51},"source":{"name":"Golden Globes Winners & Nominees Database","reference":"https://goldenglobes.com/winners-nominees/","checkedAt":"2026-08-21"},"results":[{"categoryId":"motion-picture-drama","status":"winner","sourceCategory":"Best Motion Picture - Drama","sourceRecordId":65758,"work":{"mediaType":"movie","title":"Schindler's List","releaseYear":1993,"tmdbId":424,"imdbId":"tt0108052"}},{"categoryId":"motion-picture-musical-or-comedy","status":"winner","sourceCategory":"Best Motion Picture - Musical or Comedy","sourceRecordId":66000,"work":{"mediaType":"movie","title":"Mrs. Doubtfire","releaseYear":1993,"tmdbId":788,"imdbId":"tt0107614"}},{"categoryId":"motion-picture-non-english-language","status":"winner","sourceCategory":"Best Motion Picture – Non-English Language","sourceRecordId":67063,"work":{"mediaType":"movie","title":"Farewell My Concubine","releaseYear":1993,"tmdbId":10997,"imdbId":"tt0106332"},"recipientLabel":"Hong Kong"},{"categoryId":"female-actor-motion-picture-drama","status":"winner","sourceCategory":"Best Performance by an Actress in a Motion Picture - Drama","sourceRecordId":69678,"work":{"mediaType":"movie","title":"The Piano","releaseYear":1993,"tmdbId":713,"imdbId":"tt0107822"},"people":[{"name":"Holly Hunter","tmdbId":18686}]},{"categoryId":"male-actor-motion-picture-drama","status":"winner","sourceCategory":"Best Performance by an Actor in a Motion Picture - Drama","sourceRecordId":64972,"work":{"mediaType":"movie","title":"Philadelphia","releaseYear":1993,"tmdbId":9800,"imdbId":"tt0107818"},"people":[{"name":"Tom Hanks","tmdbId":31}]},{"categoryId":"female-actor-motion-picture-musical-or-comedy","status":"winner","sourceCategory":"Best Performance by an Actress in a Motion Picture - Musical or Comedy","sourceRecordId":68395,"work":{"mediaType":"movie","title":"What's Love Got to Do with It","releaseYear":1993,"tmdbId":15765,"imdbId":"tt0108551"},"people":[{"name":"Angela Bassett"}]},{"categoryId":"male-supporting-actor-motion-picture","status":"winner","sourceCategory":"Best Performance by an Actor in a Supporting Role in any Motion Picture","sourceRecordId":69182,"work":{"mediaType":"movie","title":"The Fugitive","releaseYear":1993,"tmdbId":5503,"imdbId":"tt0106977"},"people":[{"name":"Tommy Lee Jones","tmdbId":2176}]},{"categoryId":"director-motion-picture","status":"winner","sourceCategory":"Best Director - Motion Picture","sourceRecordId":66886,"work":{"mediaType":"movie","title":"Schindler's List","releaseYear":1993,"tmdbId":424,"imdbId":"tt0108052"},"people":[{"name":"Steven Spielberg","tmdbId":488}]},{"categoryId":"screenplay-motion-picture","status":"winner","sourceCategory":"Best Screenplay - Motion Picture","sourceRecordId":65425,"work":{"mediaType":"movie","title":"Schindler's List","releaseYear":1993,"tmdbId":424,"imdbId":"tt0108052"},"people":[{"name":"Steven Zaillian","tmdbId":2260,"imdbId":"nm0001873"}]},{"categoryId":"original-score-motion-picture","status":"winner","sourceCategory":"Best Original Score - Motion Picture","sourceRecordId":66655,"work":{"mediaType":"movie","title":"Heaven & Earth","releaseYear":1993,"tmdbId":31642,"imdbId":"tt0107096"},"people":[{"name":"Kitarô Kitarô"}]},{"categoryId":"original-song-motion-picture","status":"winner","sourceCategory":"Best Original Song - Motion Picture","sourceRecordId":72302,"work":{"mediaType":"movie","title":"Philadelphia","releaseYear":1993,"tmdbId":9800,"imdbId":"tt0107818"},"recipientLabel":"Streets of Philadelphia"},{"categoryId":"television-series-drama","status":"winner","sourceCategory":"Best Television Series - Drama","sourceRecordId":70548,"work":{"mediaType":"series","title":"NYPD Blue","releaseYear":1993,"tmdbId":194,"imdbId":"tt0106079"}},{"categoryId":"television-series-musical-or-comedy","status":"winner","sourceCategory":"Best Television Series - Musical or Comedy","sourceRecordId":70728,"work":{"mediaType":"series","title":"Seinfeld","releaseYear":1989,"tmdbId":1400,"imdbId":"tt0098904"}},{"categoryId":"television-limited-anthology-or-movie","status":"winner","sourceCategory":"Best Television Limited Series, Anthology Series, or Motion Picture Made for Television","sourceRecordId":70890,"work":{"mediaType":"movie","title":"Barbarians at the Gate","releaseYear":1993,"tmdbId":27678,"imdbId":"tt0106356"}},{"categoryId":"male-actor-television-series-drama","status":"winner","sourceCategory":"Best Performance by an Actor In A Television Series - Drama","sourceRecordId":65143,"work":{"mediaType":"series","title":"NYPD Blue","releaseYear":1993,"tmdbId":194,"imdbId":"tt0106079"},"people":[{"name":"David Caruso"}]},{"categoryId":"male-actor-television-series-musical-or-comedy","status":"winner","sourceCategory":"Best Performance by an Actor in a Television Series - Musical or Comedy","sourceRecordId":68907,"work":{"mediaType":"series","title":"Seinfeld","releaseYear":1989,"tmdbId":1400,"imdbId":"tt0098904"},"people":[{"name":"Jerry Seinfeld"}]},{"categoryId":"female-supporting-actor-television","status":"winner","sourceCategory":"Best Performance by an Actress in a Supporting Role in a Series, Limited Series or Motion Picture Made for Television","sourceRecordId":67807,"work":{"mediaType":"series","title":"Seinfeld","releaseYear":1989,"tmdbId":1400,"imdbId":"tt0098904"},"people":[{"name":"Julia Louis-Dreyfus"}]},{"categoryId":"male-supporting-actor-television","status":"winner","sourceCategory":"Best Performance by an Actor in a Supporting Role in a Series, Limited Series or Motion Picture Made for Television","sourceRecordId":69359,"work":{"mediaType":"movie","title":"The Positively True Adventures of the Alleged Texas Cheerleader-Murdering Mom","releaseYear":1993,"tmdbId":67595,"imdbId":"tt0107861"},"people":[{"name":"Beau Bridges"}]},{"categoryId":"male-actor-motion-picture-musical-or-comedy","status":"winner","sourceCategory":"Best Performance by an Actor in a Motion Picture - Musical or Comedy","sourceRecordId":68737,"work":{"mediaType":"movie","title":"Mrs. Doubtfire","releaseYear":1993,"tmdbId":788,"imdbId":"tt0107614"},"people":[{"name":"Robin Williams","tmdbId":2157}]},{"categoryId":"female-supporting-actor-motion-picture","status":"winner","sourceCategory":"Best Performance by an Actress in a Supporting Role in any Motion Picture","sourceRecordId":67628,"work":{"mediaType":"movie","title":"The Age of Innocence","releaseYear":1993,"tmdbId":10436,"imdbId":"tt0106226"},"people":[{"name":"Winona Ryder"}]},{"categoryId":"female-actor-television-series-musical-or-comedy","status":"winner","sourceCategory":"Best Performance by an Actress in a Television Series - Musical or Comedy","sourceRecordId":67346,"work":{"mediaType":"series","title":"Mad About You","releaseYear":1992,"tmdbId":500,"imdbId":"tt0103484"},"people":[{"name":"Helen Hunt","tmdbId":9994}]},{"categoryId":"female-actor-limited-anthology-or-television-movie","status":"winner","sourceCategory":"Best Performance by an Actress in a Limited Series, Anthology Series, or a Motion Picture Made for Television","sourceRecordId":68136,"work":{"mediaType":"movie","title":"Gypsy","releaseYear":1994,"tmdbId":17912,"imdbId":"tt0107065"},"people":[{"name":"Bette Midler"}]},{"categoryId":"female-actor-television-series-drama","status":"winner","sourceCategory":"Best Performance by an Actress In A Television Series - Drama","sourceRecordId":68013,"work":{"mediaType":"series","title":"Picket Fences","releaseYear":1992,"tmdbId":206,"imdbId":"tt0103512"},"people":[{"name":"Kathy Baker"}]},{"categoryId":"male-actor-limited-anthology-or-television-movie","status":"winner","sourceCategory":"Best Performance by an Actor in a Limited Series, Anthology Series, or a Motion Picture Made for Television","sourceRecordId":65270,"work":{"mediaType":"movie","title":"Barbarians at the Gate","releaseYear":1993,"tmdbId":27678,"imdbId":"tt0106356"},"people":[{"name":"James Garner"}]}]}
