{"$schema":"../../../../schema/award-results.schema.json","schemaVersion":1,"awardBodyId":"bafta-television-craft","ceremony":{"year":2004,"number":57},"source":{"name":"British Academy of Film and Television Arts","reference":"https://www.bafta.org/awards/tv-craft/","checkedAt":"2026-08-22"},"results":[{"categoryId":"television-craft-costume-design","status":"winner","sourceCategory":"Costume Design","sourceRecordId":349892,"work":{"mediaType":"series","title":"Charles II: The Power and The Passion","releaseYear":2003,"tmdbId":19311,"imdbId":"tt0364800"},"people":[{"name":"Mike O’Neill"}]},{"categoryId":"television-craft-editing-factual","status":"winner","sourceCategory":"Editing: Factual","sourceRecordId":349896,"work":{"mediaType":"series","title":"Arena","releaseYear":1975,"tmdbId":2050,"imdbId":"tt0199184"},"people":[{"name":"Sean Mackenzie"}]},{"categoryId":"television-craft-editing-fiction","status":"winner","sourceCategory":"Editing - Fiction/Entertainment","sourceRecordId":349898,"work":{"mediaType":"series","title":"State of Play","releaseYear":2003,"tmdbId":4043,"imdbId":"tt0362192"},"people":[{"name":"Mark Day"}]},{"categoryId":"television-craft-make-up-hair-design","status":"winner","sourceCategory":"Make Up & Hair Design","sourceRecordId":349907,"work":{"mediaType":"series","title":"Little Britain","releaseYear":2003,"tmdbId":380,"imdbId":"tt0358856"},"people":[{"name":"Lisa Cavalli-Green"}]},{"categoryId":"television-craft-emerging-talent-factual","status":"winner","sourceCategory":"New Director - Factual","sourceRecordId":349911,"work":{"mediaType":"movie","title":"Nine Lives of Alice Martineau","releaseYear":2003,"imdbId":"tt0415181"},"people":[{"name":"Oli Barry"}]},{"categoryId":"television-craft-emerging-talent-fiction","status":"winner","sourceCategory":"New Director - Fiction","sourceRecordId":349914,"work":{"mediaType":"movie","title":"This Little Life","releaseYear":2003,"tmdbId":478802,"imdbId":"tt0327691"},"people":[{"name":"Sarah Gavron"}]},{"categoryId":"television-craft-emerging-talent-fiction","status":"winner","sourceCategory":"New Writer","sourceRecordId":349920,"work":{"mediaType":"movie","title":"This Little Life","releaseYear":2003,"tmdbId":478802,"imdbId":"tt0327691"},"people":[{"name":"Rosemary Kay"}]},{"categoryId":"television-craft-photography-factual","status":"winner","sourceCategory":"Photography: Factual","sourceRecordId":349927,"work":{"mediaType":"series","title":"Ancient Egyptians","releaseYear":2003,"tmdbId":43614,"imdbId":"tt0386913"},"people":[{"name":"Peter Greenhalgh"}]},{"categoryId":"television-craft-photography-lighting-fiction","status":"winner","sourceCategory":"Photography & Lighting: Fiction","sourceRecordId":349932,"work":{"mediaType":"series","title":"Charles II: The Power and The Passion","releaseYear":2003,"tmdbId":19311,"imdbId":"tt0364800"},"people":[{"name":"Ryszard Lenczewski"}]},{"categoryId":"television-craft-production-design","status":"winner","sourceCategory":"Production Design","sourceRecordId":349937,"work":{"mediaType":"series","title":"The Lost Prince","releaseYear":2003,"tmdbId":13688,"imdbId":"tt0349747"},"people":[{"name":"John-Paul Kelly"}]},{"categoryId":"television-craft-sound-factual","status":"winner","sourceCategory":"Sound: Factual","sourceRecordId":349941,"work":{"mediaType":"series","title":"Operatunity","releaseYear":2003,"imdbId":"tt9020296"},"people":[{"name":"Trevor Hotz"},{"name":"Paul Parsons"},{"name":"Graham Haines"}]},{"categoryId":"television-craft-sound-fiction","status":"winner","sourceCategory":"Sound - Fiction/Entertainment","sourceRecordId":349944,"work":{"mediaType":"series","title":"State of Play","releaseYear":2003,"tmdbId":4043,"imdbId":"tt0362192"},"people":[{"name":"Simon Okin"},{"name":"Stuart Hilliker"},{"name":"Jamie McPhee"},{"name":"Pat Boxshall"}]},{"categoryId":"television-craft-special-visual-graphic-effects","status":"winner","sourceCategory":"Visual Effects","sourceRecordId":349949,"work":{"mediaType":"series","title":"Sea Monsters","releaseYear":2003,"tmdbId":19835,"imdbId":"tt0469006"},"people":[{"name":"Max Tyrie"},{"name":"Tim Greenwood"},{"name":"Jez Gibson-Harris"},{"name":"Jamie Campbell"}]}]}
