{"$schema":"../../../../schema/award-results.schema.json","schemaVersion":1,"awardBodyId":"golden-globes","ceremony":{"year":1974,"number":31},"source":{"name":"Golden Globes Winners & Nominees Database","reference":"https://goldenglobes.com/winners-nominees/","checkedAt":"2026-08-21"},"results":[{"categoryId":"motion-picture-drama","status":"winner","sourceCategory":"Best Motion Picture - Drama","sourceRecordId":65738,"work":{"mediaType":"movie","title":"The Exorcist","releaseYear":1973,"tmdbId":9552,"imdbId":"tt0070047"}},{"categoryId":"motion-picture-musical-or-comedy","status":"winner","sourceCategory":"Best Motion Picture - Musical or Comedy","sourceRecordId":65980,"work":{"mediaType":"movie","title":"American Graffiti","releaseYear":1973,"tmdbId":838,"imdbId":"tt0069704"}},{"categoryId":"motion-picture-non-english-language","status":"winner","sourceCategory":"Best Motion Picture – Non-English Language","sourceRecordId":67043,"work":{"mediaType":"movie","title":"The Pedestrian","releaseYear":1973,"tmdbId":42460,"imdbId":"tt0070086"},"recipientLabel":"West Germany"},{"categoryId":"female-actor-motion-picture-drama","status":"winner","sourceCategory":"Best Performance by an Actress in a Motion Picture - Drama","sourceRecordId":69657,"work":{"mediaType":"movie","title":"Cinderella Liberty","releaseYear":1973,"tmdbId":84847,"imdbId":"tt0069883"},"people":[{"name":"Marsha Mason"}]},{"categoryId":"male-actor-motion-picture-drama","status":"winner","sourceCategory":"Best Performance by an Actor in a Motion Picture - Drama","sourceRecordId":64953,"work":{"mediaType":"movie","title":"Serpico","releaseYear":1973,"tmdbId":9040,"imdbId":"tt0070666"},"people":[{"name":"Al Pacino","tmdbId":1158}]},{"categoryId":"female-actor-motion-picture-musical-or-comedy","status":"winner","sourceCategory":"Best Performance by an Actress in a Motion Picture - Musical or Comedy","sourceRecordId":68373,"work":{"mediaType":"movie","title":"A Touch of Class","releaseYear":1973,"tmdbId":42458,"imdbId":"tt0070819"},"people":[{"name":"Glenda Jackson","tmdbId":115573}]},{"categoryId":"male-supporting-actor-motion-picture","status":"winner","sourceCategory":"Best Performance by an Actor in a Supporting Role in any Motion Picture","sourceRecordId":69161,"work":{"mediaType":"movie","title":"The Paper Chase","releaseYear":1973,"tmdbId":14328,"imdbId":"tt0070509"},"people":[{"name":"John Houseman","tmdbId":11783}]},{"categoryId":"director-motion-picture","status":"winner","sourceCategory":"Best Director - Motion Picture","sourceRecordId":66866,"work":{"mediaType":"movie","title":"The Exorcist","releaseYear":1973,"tmdbId":9552,"imdbId":"tt0070047"},"people":[{"name":"William Friedkin","tmdbId":15175}]},{"categoryId":"screenplay-motion-picture","status":"winner","sourceCategory":"Best Screenplay - Motion Picture","sourceRecordId":65406,"work":{"mediaType":"movie","title":"The Exorcist","releaseYear":1973,"tmdbId":9552,"imdbId":"tt0070047"},"people":[{"name":"William Peter Blatty","tmdbId":57922,"imdbId":"nm0087861"}]},{"categoryId":"original-score-motion-picture","status":"winner","sourceCategory":"Best Original Score - Motion Picture","sourceRecordId":66637,"work":{"mediaType":"movie","title":"Jonathan Livingston Seagull","releaseYear":1973,"tmdbId":56150,"imdbId":"tt0070248"},"people":[{"name":"Neil Diamond"}]},{"categoryId":"original-song-motion-picture","status":"winner","sourceCategory":"Best Original Song - Motion Picture","sourceRecordId":71607,"work":{"mediaType":"movie","title":"The Way We Were","releaseYear":1973,"tmdbId":10236,"imdbId":"tt0070903"},"note":"The official archive does not provide the winning song title."},{"categoryId":"television-series-drama","status":"winner","sourceCategory":"Best Television Series - Drama","sourceRecordId":70528,"work":{"mediaType":"series","title":"The Waltons","releaseYear":1972,"tmdbId":5021,"imdbId":"tt0068149"}},{"categoryId":"television-series-musical-or-comedy","status":"winner","sourceCategory":"Best Television Series - Musical or Comedy","sourceRecordId":70707,"work":{"mediaType":"series","title":"All in the Family","releaseYear":1971,"tmdbId":1922,"imdbId":"tt0066626"}},{"categoryId":"male-actor-television-series-drama","status":"winner","sourceCategory":"Best Performance by an Actor In A Television Series - Drama","sourceRecordId":65123,"work":{"mediaType":"series","title":"Hawkins","releaseYear":1973,"tmdbId":9844,"imdbId":"tt0069589"},"people":[{"name":"James Stewart","tmdbId":854}]},{"categoryId":"male-actor-television-series-musical-or-comedy","status":"winner","sourceCategory":"Best Performance by an Actor in a Television Series - Musical or Comedy","sourceRecordId":68885,"work":{"mediaType":"series","title":"The Odd Couple","releaseYear":1970,"tmdbId":1809,"imdbId":"tt0065329"},"people":[{"name":"Jack Klugman"}]},{"categoryId":"female-supporting-actor-television","status":"winner","sourceCategory":"Best Performance by an Actress in a Supporting Role in a Series, Limited Series or Motion Picture Made for Television","sourceRecordId":67787,"work":{"mediaType":"series","title":"The Waltons","releaseYear":1972,"tmdbId":5021,"imdbId":"tt0068149"},"people":[{"name":"Ellen Corby"}]},{"categoryId":"male-supporting-actor-television","status":"winner","sourceCategory":"Best Performance by an Actor in a Supporting Role in a Series, Limited Series or Motion Picture Made for Television","sourceRecordId":69336,"work":{"mediaType":"series","title":"M*A*S*H","releaseYear":1972,"tmdbId":918,"imdbId":"tt0068098"},"people":[{"name":"McLean Stevenson"}]},{"categoryId":"male-actor-motion-picture-musical-or-comedy","status":"winner","sourceCategory":"Best Performance by an Actor in a Motion Picture - Musical or Comedy","sourceRecordId":68716,"work":{"mediaType":"movie","title":"A Touch of Class","releaseYear":1973,"tmdbId":42458,"imdbId":"tt0070819"},"people":[{"name":"George Segal"}]},{"categoryId":"female-supporting-actor-motion-picture","status":"winner","sourceCategory":"Best Performance by an Actress in a Supporting Role in any Motion Picture","sourceRecordId":67608,"work":{"mediaType":"movie","title":"The Exorcist","releaseYear":1973,"tmdbId":9552,"imdbId":"tt0070047"},"people":[{"name":"Linda Blair"}]},{"categoryId":"female-actor-television-series-musical-or-comedy","status":"winner","sourceCategory":"Best Performance by an Actress in a Television Series - Musical or Comedy","sourceRecordId":68545,"work":{"mediaType":"series","title":"The Sonny & Cher Comedy Hour","releaseYear":1971,"tmdbId":1090,"imdbId":"tt0066717"},"people":[{"name":"Cher","tmdbId":38225}]},{"categoryId":"female-actor-television-series-musical-or-comedy","status":"winner","sourceCategory":"Best Performance by an Actress in a Television Series - Musical or Comedy","sourceRecordId":68546,"work":{"mediaType":"series","title":"All in the Family","releaseYear":1971,"tmdbId":1922,"imdbId":"tt0066626"},"people":[{"name":"Jean Stapleton"}]},{"categoryId":"female-actor-television-series-drama","status":"winner","sourceCategory":"Best Performance by an Actress In A Television Series - Drama","sourceRecordId":67991,"work":{"mediaType":"series","title":"The Blue Knight","releaseYear":1973,"tmdbId":303604,"imdbId":"tt0069806"},"people":[{"name":"Lee Remick"}]}]}
