{"$schema":"../../../../schema/award-results.schema.json","schemaVersion":1,"awardBodyId":"bafta-television-craft","ceremony":{"year":2017,"number":70},"source":{"name":"British Academy of Film and Television Arts","reference":"https://www.bafta.org/awards/tv-craft/","checkedAt":"2026-08-22"},"results":[{"categoryId":"television-craft-costume-design","status":"winner","sourceCategory":"Costume Design","sourceRecordId":356045,"work":{"mediaType":"series","title":"The Crown","releaseYear":2016,"tmdbId":65494,"imdbId":"tt4786824"},"people":[{"name":"Michele Clapton"}]},{"categoryId":"television-craft-director-factual","status":"winner","sourceCategory":"Director: Factual","sourceRecordId":356054,"work":{"mediaType":"series","title":"Exodus: Our Journey","releaseYear":2016,"tmdbId":74776,"imdbId":"tt5905508"},"people":[{"name":"James Bluemel","tmdbId":1914151,"imdbId":"nm2486028"}]},{"categoryId":"television-craft-director-fiction","status":"winner","sourceCategory":"Director: Fiction","sourceRecordId":356057,"work":{"mediaType":"series","title":"National Treasure","releaseYear":2016,"tmdbId":67716,"imdbId":"tt5571524"},"people":[{"name":"Marc Munden","tmdbId":176484,"imdbId":"nm0612720"}]},{"categoryId":"television-craft-director-multi-camera","status":"winner","sourceCategory":"Director: Multi-Camera","sourceRecordId":356060,"work":{"mediaType":"series","title":"Ant & Dec's Saturday Night Takeaway","releaseYear":2002,"tmdbId":2564,"imdbId":"tt0324692"},"people":[{"name":"Chris Power"}]},{"categoryId":"television-craft-editing-factual","status":"winner","sourceCategory":"Editing: Factual","sourceRecordId":356064,"work":{"mediaType":"movie","title":"Hillsborough","releaseYear":2016,"tmdbId":264759,"imdbId":"tt5698100"},"people":[{"name":"Andy Worboys"}]},{"categoryId":"television-craft-editing-fiction","status":"winner","sourceCategory":"Editing: Fiction","sourceRecordId":356069,"work":{"mediaType":"series","title":"The Night Manager","releaseYear":2016,"tmdbId":61859,"imdbId":"tt1399664"},"people":[{"name":"Ben Lester"}]},{"categoryId":"television-craft-entertainment-craft-team","status":"winner","sourceCategory":"Entertainment Craft Team","sourceRecordId":356072,"work":{"mediaType":"series","title":"Royal British Legion Festival of Remembrance","releaseYear":1950,"imdbId":"tt10069230"},"people":[{"name":"Bernie Davis"},{"name":"David Cole"},{"name":"Kevin Duff"},{"name":"Patrick Doherty"}]},{"categoryId":"television-craft-make-up-hair-design","status":"winner","sourceCategory":"Make Up & Hair Design","sourceRecordId":356078,"work":{"mediaType":"series","title":"Black Mirror","releaseYear":2011,"tmdbId":42009,"imdbId":"tt2085059"},"people":[{"name":"Tanya Lodge"}]},{"categoryId":"television-craft-photography-lighting-fiction","status":"winner","sourceCategory":"Photography & Lighting: Fiction","sourceRecordId":356085,"work":{"mediaType":"series","title":"Rillington Place","releaseYear":2016,"tmdbId":68800,"imdbId":"tt5568438"},"people":[{"name":"James Friend"}]},{"categoryId":"television-craft-photography-factual","status":"winner","sourceCategory":"Photography: Factual","sourceRecordId":356088,"work":{"mediaType":"series","title":"Planet Earth II","releaseYear":2016,"tmdbId":68595,"imdbId":"tt5491994"},"people":[{"name":"John Aitchison"},{"name":"Rob Whitworth"},{"name":"Mark MacEwen"}]},{"categoryId":"television-craft-production-design","status":"winner","sourceCategory":"Production Design","sourceRecordId":356092,"work":{"mediaType":"series","title":"War and Peace","releaseYear":2016,"tmdbId":64099,"imdbId":"tt3910804"},"people":[{"name":"Chris Roope"}]},{"categoryId":"television-craft-sound-factual","status":"winner","sourceCategory":"Sound: Factual","sourceRecordId":356096,"work":{"mediaType":"series","title":"Planet Earth II","releaseYear":2016,"tmdbId":68595,"imdbId":"tt5491994"},"people":[{"name":"Graham Wild"},{"name":"Kate Hopkins"},{"name":"Tim Owens"}]},{"categoryId":"television-craft-sound-fiction","status":"winner","sourceCategory":"Sound: Fiction","sourceRecordId":356100,"work":{"mediaType":"series","title":"The Night Manager","releaseYear":2016,"tmdbId":61859,"imdbId":"tt1399664"},"people":[{"name":"Aitor Berenguer"},{"name":"Howard Bargroff"},{"name":"Alex Sawyer"},{"name":"Adam Armitage"}]},{"categoryId":"television-craft-special-visual-graphic-effects","status":"winner","sourceCategory":"Special, Visual And Graphic Effects","sourceRecordId":356108,"work":{"mediaType":"series","title":"The Crown","releaseYear":2016,"tmdbId":65494,"imdbId":"tt4786824"},"people":[{"name":"One of Us"},{"name":"Molinare"}]},{"categoryId":"television-craft-titles-graphic-identity","status":"winner","sourceCategory":"Titles & Graphic Identity","sourceRecordId":356113,"work":{"mediaType":"series","title":"Paralympics 2016"},"people":[{"name":"Richard Norley"},{"name":"Lee Jacobs"},{"name":"Callum O'Reilly"}],"note":"The award credits the Channel 4 title/graphics team Richard Norley, Lee Jacobs and Callum O'Reilly. Review did not verify a compatible IMDb parent for that coverage; generic event, opening/closing ceremony and NBC records are not substituted."},{"categoryId":"television-craft-writer-comedy","status":"winner","sourceCategory":"Writer: Comedy","sourceRecordId":356116,"work":{"mediaType":"series","title":"Mum","releaseYear":2016,"tmdbId":66372,"imdbId":"tt5687446"},"people":[{"name":"Stefan Golaszewski"}]},{"categoryId":"television-craft-writer-drama","status":"winner","sourceCategory":"Writer: Drama","sourceRecordId":356120,"work":{"mediaType":"series","title":"Happy Valley","releaseYear":2014,"tmdbId":61244,"imdbId":"tt3428912"},"people":[{"name":"Sally Wainwright"}]}]}
