{"$schema":"../../../../schema/award-results.schema.json","schemaVersion":1,"awardBodyId":"bafta-television-craft","ceremony":{"year":1956,"number":9},"source":{"name":"British Academy of Film and Television Arts","reference":"https://www.bafta.org/awards/tv-craft/","checkedAt":"2026-08-22"},"results":[]}
