{"$schema":"../../../../schema/award-results.schema.json","schemaVersion":1,"awardBodyId":"bafta-television","ceremony":{"year":1985,"number":38},"source":{"name":"British Academy of Film and Television Arts","reference":"https://www.bafta.org/awards/television/","checkedAt":"2026-08-22"},"results":[{"categoryId":"television-leading-actor","status":"winner","sourceCategory":"Actor","sourceRecordId":346573,"work":{"mediaType":"series","title":"The Jewel in the Crown","releaseYear":1984,"tmdbId":3591,"imdbId":"tt0086739"},"people":[{"name":"Tim Pigott-Smith","tmdbId":11276,"imdbId":"nm0683116"}]},{"categoryId":"television-leading-actress","status":"winner","sourceCategory":"Actress","sourceRecordId":346574,"work":{"mediaType":"series","title":"The Jewel in the Crown","releaseYear":1984,"tmdbId":3591,"imdbId":"tt0086739"},"people":[{"name":"Peggy Ashcroft","tmdbId":3672,"imdbId":"nm0001919"}]},{"categoryId":"television-childrens-non-scripted","status":"winner","sourceCategory":"Children's Programme - Documentary - Educational","sourceRecordId":346585,"work":{"mediaType":"series","title":"Middle English","releaseYear":1981,"imdbId":"tt32085850"},"people":[{"name":"Peter Tabern"}]},{"categoryId":"television-childrens-scripted","status":"winner","sourceCategory":"Children's Programme - Entertainment/Drama","sourceRecordId":346588,"work":{"mediaType":"series","title":"The Box of Delights","releaseYear":1984,"tmdbId":21353,"imdbId":"tt0086675"},"people":[{"name":"Paul Stone"},{"name":"Renny Rye"}]},{"categoryId":"television-scripted-comedy","status":"winner","sourceCategory":"Comedy Series","sourceRecordId":346595,"work":{"mediaType":"series","title":"The Young Ones","releaseYear":1982,"tmdbId":4483,"imdbId":"tt0083505"},"people":[{"name":"Paul Jackson"}]},{"categoryId":"television-factual-series","status":"winner","sourceCategory":"Factual Series","sourceRecordId":346603,"work":{"mediaType":"series","title":"River Journeys","releaseYear":1984,"imdbId":"tt28500169"},"people":[{"name":"Roger Laughton"},{"name":"David Wallace"}]},{"categoryId":"television-single-documentary","status":"winner","sourceCategory":"Flaherty Documentary Award","sourceRecordId":346607,"work":{"mediaType":"movie","title":"28 Up","releaseYear":1984,"tmdbId":20561,"imdbId":"tt0088650"},"people":[{"name":"Michael Apted"}]},{"categoryId":"television-international","status":"winner","sourceCategory":"Foreign Television Programme","sourceRecordId":346608,"work":{"mediaType":"series","title":"Das Boot","releaseYear":1985,"tmdbId":156249,"imdbId":"tt0081834"}},{"categoryId":"television-entertainment-performance","status":"winner","sourceCategory":"Light Entertainment Performance","sourceRecordId":346609,"work":{"mediaType":"series","title":"A Fine Romance","releaseYear":1981,"tmdbId":5105,"imdbId":"tt0083416"},"people":[{"name":"Judi Dench","tmdbId":5309,"imdbId":"nm0001132"}]},{"categoryId":"television-entertainment","status":"winner","sourceCategory":"Light Entertainment","sourceRecordId":346614,"work":{"mediaType":"movie","title":"Another Audience with Dame Edna Everage","releaseYear":1984,"tmdbId":1110327,"imdbId":"tt0490555"},"people":[{"name":"Richard Drewett"}]},{"categoryId":"television-limited-drama","status":"winner","sourceCategory":"Single Drama","sourceRecordId":346633,"work":{"mediaType":"movie","title":"Threads","releaseYear":1984,"tmdbId":17835,"imdbId":"tt0090163"},"people":[{"name":"Mick Jackson"}]}]}
