{"$schema":"../../../../schema/award-results.schema.json","schemaVersion":1,"awardBodyId":"golden-globes","ceremony":{"year":1948,"number":5},"source":{"name":"Golden Globes Winners & Nominees Database","reference":"https://goldenglobes.com/winners-nominees/","checkedAt":"2026-08-21"},"results":[{"categoryId":"female-actor-motion-picture-drama","status":"winner","sourceCategory":"Actress In A Leading Role","sourceRecordId":69424,"work":{"mediaType":"movie","title":"Mourning Becomes Electra","releaseYear":1947,"tmdbId":82101,"imdbId":"tt0039636"},"people":[{"name":"Rosalind Russell"}]},{"categoryId":"male-actor-motion-picture-drama","status":"winner","sourceCategory":"Actor In A Leading Role","sourceRecordId":64716,"work":{"mediaType":"movie","title":"A Double Life","releaseYear":1947,"tmdbId":41206,"imdbId":"tt0039335"},"people":[{"name":"Ronald Colman","tmdbId":29522}]},{"categoryId":"male-supporting-actor-motion-picture","status":"winner","sourceCategory":"Best Performance by an Actor in a Supporting Role in any Motion Picture","sourceRecordId":69136,"work":{"mediaType":"movie","title":"Miracle on 34th Street","releaseYear":1947,"tmdbId":11881,"imdbId":"tt0039628"},"people":[{"name":"Edmund Gwenn","tmdbId":22600}]},{"categoryId":"director-motion-picture","status":"winner","sourceCategory":"Best Director - Motion Picture","sourceRecordId":66840,"work":{"mediaType":"movie","title":"Gentleman's Agreement","releaseYear":1947,"tmdbId":33667,"imdbId":"tt0039416"},"people":[{"name":"Elia Kazan","tmdbId":2746}]},{"categoryId":"screenplay-motion-picture","status":"winner","sourceCategory":"Best Screenplay - Motion Picture","sourceRecordId":65390,"work":{"mediaType":"movie","title":"Miracle on 34th Street","releaseYear":1947,"tmdbId":11881,"imdbId":"tt0039628"},"people":[{"name":"George Seaton","tmdbId":24939,"imdbId":"nm0780833"}]},{"categoryId":"original-score-motion-picture","status":"winner","sourceCategory":"Best Original Score - Motion Picture","sourceRecordId":66618,"work":{"mediaType":"movie","title":"Life with Father","releaseYear":1947,"tmdbId":41465,"imdbId":"tt0039566"},"people":[{"name":"Max Steiner","tmdbId":3249,"imdbId":"nm0000070"}]},{"categoryId":"female-supporting-actor-motion-picture","status":"winner","sourceCategory":"Best Performance by an Actress in a Supporting Role in any Motion Picture","sourceRecordId":67581,"work":{"mediaType":"movie","title":"Gentleman's Agreement","releaseYear":1947,"tmdbId":33667,"imdbId":"tt0039416"},"people":[{"name":"Celeste Holm","tmdbId":10607}]},{"categoryId":"motion-picture-drama","status":"winner","sourceCategory":"Picture","sourceRecordId":72445,"work":{"mediaType":"movie","title":"Gentleman's Agreement","releaseYear":1947,"tmdbId":33667,"imdbId":"tt0039416"}}]}
