{"$schema":"../../../../schema/award-results.schema.json","schemaVersion":1,"awardBodyId":"bafta-television-craft","ceremony":{"year":2020,"number":73},"source":{"name":"British Academy of Film and Television Arts","reference":"https://www.bafta.org/awards/tv-craft/","checkedAt":"2026-08-22"},"results":[{"categoryId":"television-craft-costume-design","status":"winner","sourceCategory":"Costume Design","sourceRecordId":359015,"work":{"mediaType":"series","title":"Chernobyl","releaseYear":2019,"tmdbId":87108,"imdbId":"tt7366338"},"people":[{"name":"Odile Dicks-Mireaux"}]},{"categoryId":"television-craft-director-factual","status":"winner","sourceCategory":"Director: Factual","sourceRecordId":359016,"work":{"mediaType":"movie","title":"The Last Survivors","releaseYear":2019,"tmdbId":578399,"imdbId":"tt9663110"},"people":[{"name":"Arthur Cary","tmdbId":1688335},{"name":"Morgan Matthews","tmdbId":1184816,"imdbId":"nm2051728"},{"name":"Katherine Anstey"},{"name":"Joby Gee"}]},{"categoryId":"television-craft-director-fiction","status":"winner","sourceCategory":"Director: Fiction","sourceRecordId":359021,"work":{"mediaType":"series","title":"Chernobyl","releaseYear":2019,"tmdbId":87108,"imdbId":"tt7366338"},"people":[{"name":"Johan Renck","tmdbId":212408,"imdbId":"nm0719307"}]},{"categoryId":"television-craft-director-multi-camera","status":"winner","sourceCategory":"Director: Multi-Camera","sourceRecordId":359025,"work":{"mediaType":"series","title":"Glastonbury 2019","releaseYear":2019,"imdbId":"tt10533670"},"people":[{"name":"Janet Fraser Crook"}]},{"categoryId":"television-craft-editing-factual","status":"winner","sourceCategory":"Editing: Factual","sourceRecordId":359031,"work":{"mediaType":"series","title":"Don't F**k with Cats: Hunting an Internet Killer","releaseYear":2019,"tmdbId":96129,"imdbId":"tt11318602"},"people":[{"name":"Michael Harte"}]},{"categoryId":"television-craft-editing-fiction","status":"winner","sourceCategory":"Editing: Fiction","sourceRecordId":359035,"work":{"mediaType":"series","title":"Chernobyl","releaseYear":2019,"tmdbId":87108,"imdbId":"tt7366338"},"people":[{"name":"Simon Smith"},{"name":"Jinx Godfrey"}]},{"categoryId":"television-craft-entertainment-craft-team","status":"winner","sourceCategory":"Entertainment Craft Team","sourceRecordId":359037,"work":{"mediaType":"series","title":"Strictly Come Dancing","releaseYear":2004,"tmdbId":1711,"imdbId":"tt0411027"},"people":[{"name":"David Bishop"},{"name":"Vicky Gill"},{"name":"Andy Tapley"},{"name":"Patrick Doherty"}]},{"categoryId":"television-craft-make-up-hair-design","status":"winner","sourceCategory":"Make Up & Hair Design","sourceRecordId":359043,"work":{"mediaType":"series","title":"Peaky Blinders","releaseYear":2013,"tmdbId":60574,"imdbId":"tt2442560"},"people":[{"name":"Loz Schiavo"}]},{"categoryId":"television-craft-photography-factual","status":"winner","sourceCategory":"Photography: Factual","sourceRecordId":359048,"work":{"mediaType":"series","title":"Seven Worlds, One Planet","releaseYear":2019,"tmdbId":90790,"imdbId":"tt9805708"},"people":[{"name":"Bertie Gregory"},{"name":"Howard Bourne"},{"name":"John Shier"}]},{"categoryId":"television-craft-photography-lighting-fiction","status":"winner","sourceCategory":"Photography & Lighting: Fiction","sourceRecordId":359053,"work":{"mediaType":"series","title":"Chernobyl","releaseYear":2019,"tmdbId":87108,"imdbId":"tt7366338"},"people":[{"name":"Jakob Ihre"}]},{"categoryId":"television-craft-production-design","status":"winner","sourceCategory":"Production Design","sourceRecordId":359057,"work":{"mediaType":"series","title":"Chernobyl","releaseYear":2019,"tmdbId":87108,"imdbId":"tt7366338"},"people":[{"name":"Luke Hull"},{"name":"Claire Levinson-Gendler"}]},{"categoryId":"television-craft-scripted-casting","status":"winner","sourceCategory":"Scripted Casting","sourceRecordId":359060,"work":{"mediaType":"series","title":"Top Boy","releaseYear":2019,"tmdbId":93544,"imdbId":"tt1830379"},"people":[{"name":"Des Hamilton"}]},{"categoryId":"television-craft-sound-factual","status":"winner","sourceCategory":"Sound: Factual","sourceRecordId":359067,"work":{"mediaType":"series","title":"Battle of the Brass Bands"},"people":[{"name":"Sound Team"}],"note":"The reviewed 2019 Sky Arts documentary series is present as TMDB 213843 but has no IMDb external ID; exact-title IMDb and TMDB searches did not establish a compatible identity. Preserve this winner without a catalogue item."},{"categoryId":"television-craft-sound-fiction","status":"winner","sourceCategory":"Sound: Fiction","sourceRecordId":359070,"work":{"mediaType":"series","title":"Chernobyl","releaseYear":2019,"tmdbId":87108,"imdbId":"tt7366338"},"people":[{"name":"Stefan Henrix"},{"name":"Joe Beal"},{"name":"Stuart Hilliker"},{"name":"Vincent Piponnier"}]},{"categoryId":"television-craft-special-visual-graphic-effects","status":"winner","sourceCategory":"Special, Visual And Graphic Effects","sourceRecordId":359073,"work":{"mediaType":"series","title":"His Dark Materials","releaseYear":2019,"tmdbId":68507,"imdbId":"tt5607976"},"people":[{"name":"Framestore"},{"name":"Painting Practice"},{"name":"Real SFX"},{"name":"Russell Dodgson"}]},{"categoryId":"television-craft-titles-graphic-identity","status":"winner","sourceCategory":"Titles & Graphic Identity","sourceRecordId":359078,"work":{"mediaType":"series","title":"His Dark Materials","releaseYear":2019,"tmdbId":68507,"imdbId":"tt5607976"},"people":[{"name":"Elastic"},{"name":"Painting Practice"}]},{"categoryId":"television-craft-writer-comedy","status":"winner","sourceCategory":"Writer: Comedy","sourceRecordId":359081,"work":{"mediaType":"series","title":"Stath Lets Flats","releaseYear":2018,"tmdbId":80459,"imdbId":"tt7524382"},"people":[{"name":"Jamie Demetriou","tmdbId":1470911,"imdbId":"nm5857152"}]},{"categoryId":"television-craft-writer-drama","status":"winner","sourceCategory":"Writer: Drama","sourceRecordId":359086,"work":{"mediaType":"series","title":"Succession","releaseYear":2018,"tmdbId":76331,"imdbId":"tt7660850"},"people":[{"name":"Jesse Armstrong"}]}]}
