{"$schema":"../../../../schema/award-results.schema.json","schemaVersion":1,"awardBodyId":"golden-globes","ceremony":{"year":2008,"number":65},"source":{"name":"Golden Globes Winners & Nominees Database","reference":"https://goldenglobes.com/winners-nominees/","checkedAt":"2026-08-21"},"results":[{"categoryId":"motion-picture-drama","status":"winner","sourceCategory":"Best Motion Picture - Drama","sourceRecordId":71840,"work":{"mediaType":"movie","title":"Atonement","releaseYear":2007,"tmdbId":4347,"imdbId":"tt0783233"}},{"categoryId":"motion-picture-musical-or-comedy","status":"winner","sourceCategory":"Best Motion Picture - Musical or Comedy","sourceRecordId":71850,"work":{"mediaType":"movie","title":"Sweeney Todd: The Demon Barber of Fleet Street","releaseYear":2007,"tmdbId":13885,"imdbId":"tt0408236"}},{"categoryId":"motion-picture-animated","status":"winner","sourceCategory":"Best Motion Picture - Animated","sourceRecordId":71852,"work":{"mediaType":"movie","title":"Ratatouille","releaseYear":2007,"tmdbId":2062,"imdbId":"tt0382932"}},{"categoryId":"motion-picture-non-english-language","status":"winner","sourceCategory":"Best Motion Picture – Non-English Language","sourceRecordId":71044,"work":{"mediaType":"movie","title":"The Diving Bell and the Butterfly","releaseYear":2007,"tmdbId":2013,"imdbId":"tt0401383"},"recipientLabel":"France / United States"},{"categoryId":"female-actor-motion-picture-drama","status":"winner","sourceCategory":"Best Performance by an Actress in a Motion Picture - Drama","sourceRecordId":69885,"work":{"mediaType":"movie","title":"Away from Her","releaseYear":2007,"tmdbId":1919,"imdbId":"tt0491747"},"people":[{"name":"Julie Christie","tmdbId":1666}]},{"categoryId":"male-actor-motion-picture-drama","status":"winner","sourceCategory":"Best Performance by an Actor in a Motion Picture - Drama","sourceRecordId":71072,"work":{"mediaType":"movie","title":"There Will Be Blood","releaseYear":2007,"tmdbId":7345,"imdbId":"tt0469494"},"people":[{"name":"Daniel Day-Lewis","tmdbId":11856}]},{"categoryId":"female-actor-motion-picture-musical-or-comedy","status":"winner","sourceCategory":"Best Performance by an Actress in a Motion Picture - Musical or Comedy","sourceRecordId":69916,"work":{"mediaType":"movie","title":"La Vie en Rose","releaseYear":2007,"tmdbId":1407,"imdbId":"tt0450188"},"people":[{"name":"Marion Cotillard","tmdbId":8293}]},{"categoryId":"male-supporting-actor-motion-picture","status":"winner","sourceCategory":"Best Performance by an Actor in a Supporting Role in any Motion Picture","sourceRecordId":69922,"work":{"mediaType":"movie","title":"No Country for Old Men","releaseYear":2007,"tmdbId":6977,"imdbId":"tt0477348"},"people":[{"name":"Javier Bardem","tmdbId":3810}]},{"categoryId":"director-motion-picture","status":"winner","sourceCategory":"Best Director - Motion Picture","sourceRecordId":71058,"work":{"mediaType":"movie","title":"The Diving Bell and the Butterfly","releaseYear":2007,"tmdbId":2013,"imdbId":"tt0401383"},"people":[{"name":"Julian Schnabel"}]},{"categoryId":"screenplay-motion-picture","status":"winner","sourceCategory":"Best Screenplay - Motion Picture","sourceRecordId":71855,"work":{"mediaType":"movie","title":"No Country for Old Men","releaseYear":2007,"tmdbId":6977,"imdbId":"tt0477348"},"people":[{"name":"Joel Coen"},{"name":"Ethan Coen"}]},{"categoryId":"original-score-motion-picture","status":"winner","sourceCategory":"Best Original Score - Motion Picture","sourceRecordId":71063,"work":{"mediaType":"movie","title":"Atonement","releaseYear":2007,"tmdbId":4347,"imdbId":"tt0783233"},"people":[{"name":"Dario Marianelli","tmdbId":11269,"imdbId":"nm0547050"}]},{"categoryId":"original-song-motion-picture","status":"winner","sourceCategory":"Best Original Song - Motion Picture","sourceRecordId":71752,"work":{"mediaType":"movie","title":"Into the Wild","releaseYear":2007,"tmdbId":5915,"imdbId":"tt0758758"},"recipientLabel":"\"Guaranteed\""},{"categoryId":"television-series-drama","status":"winner","sourceCategory":"Best Television Series - Drama","sourceRecordId":71862,"work":{"mediaType":"series","title":"Mad Men","releaseYear":2007,"tmdbId":1104,"imdbId":"tt0804503"}},{"categoryId":"television-series-musical-or-comedy","status":"winner","sourceCategory":"Best Television Series - Musical or Comedy","sourceRecordId":71867,"work":{"mediaType":"series","title":"Extras","releaseYear":2005,"tmdbId":2693,"imdbId":"tt0445114"}},{"categoryId":"television-limited-anthology-or-movie","status":"winner","sourceCategory":"Best Television Limited Series, Anthology Series, or Motion Picture Made for Television","sourceRecordId":71872,"work":{"mediaType":"movie","title":"Longford","releaseYear":2006,"tmdbId":36328,"imdbId":"tt0759612"}},{"categoryId":"male-actor-television-series-drama","status":"winner","sourceCategory":"Best Performance by an Actor In A Television Series - Drama","sourceRecordId":71074,"work":{"mediaType":"series","title":"Mad Men","releaseYear":2007,"tmdbId":1104,"imdbId":"tt0804503"},"people":[{"name":"Jon Hamm"}]},{"categoryId":"male-actor-television-series-musical-or-comedy","status":"winner","sourceCategory":"Best Performance by an Actor in a Television Series - Musical or Comedy","sourceRecordId":71085,"work":{"mediaType":"series","title":"Californication","releaseYear":2007,"tmdbId":1215,"imdbId":"tt0904208"},"people":[{"name":"David Duchovny"}]},{"categoryId":"female-supporting-actor-television","status":"winner","sourceCategory":"Best Performance by an Actress in a Supporting Role in a Series, Limited Series or Motion Picture Made for Television","sourceRecordId":71101,"work":{"mediaType":"movie","title":"Longford","releaseYear":2006,"tmdbId":36328,"imdbId":"tt0759612"},"people":[{"name":"Samantha Morton"}]},{"categoryId":"male-supporting-actor-television","status":"winner","sourceCategory":"Best Performance by an Actor in a Supporting Role in a Series, Limited Series or Motion Picture Made for Television","sourceRecordId":71106,"work":{"mediaType":"series","title":"Entourage","releaseYear":2004,"tmdbId":1940,"imdbId":"tt0387199"},"people":[{"name":"Jeremy Piven"}]},{"categoryId":"male-actor-motion-picture-musical-or-comedy","status":"winner","sourceCategory":"Best Performance by an Actor in a Motion Picture - Musical or Comedy","sourceRecordId":69918,"work":{"mediaType":"movie","title":"Sweeney Todd: The Demon Barber of Fleet Street","releaseYear":2007,"tmdbId":13885,"imdbId":"tt0408236"},"people":[{"name":"Johnny Depp"}]},{"categoryId":"female-supporting-actor-motion-picture","status":"winner","sourceCategory":"Best Performance by an Actress in a Supporting Role in any Motion Picture","sourceRecordId":71048,"work":{"mediaType":"movie","title":"I'm Not There","releaseYear":2007,"tmdbId":3902,"imdbId":"tt0368794"},"people":[{"name":"Cate Blanchett","tmdbId":112}]},{"categoryId":"female-actor-television-series-musical-or-comedy","status":"winner","sourceCategory":"Best Performance by an Actress in a Television Series - Musical or Comedy","sourceRecordId":71080,"work":{"mediaType":"series","title":"30 Rock","releaseYear":2006,"tmdbId":4608,"imdbId":"tt0496424"},"people":[{"name":"Tina Fey"}]},{"categoryId":"female-actor-limited-anthology-or-television-movie","status":"winner","sourceCategory":"Best Performance by an Actress in a Limited Series, Anthology Series, or a Motion Picture Made for Television","sourceRecordId":71090,"work":{"mediaType":"movie","title":"Life Support","releaseYear":2007,"tmdbId":56555,"imdbId":"tt0808348"},"people":[{"name":"Queen Latifah"}]},{"categoryId":"female-actor-television-series-drama","status":"winner","sourceCategory":"Best Performance by an Actress In A Television Series - Drama","sourceRecordId":71066,"work":{"mediaType":"series","title":"Damages","releaseYear":2007,"tmdbId":4920,"imdbId":"tt0914387"},"people":[{"name":"Glenn Close"}]},{"categoryId":"male-actor-limited-anthology-or-television-movie","status":"winner","sourceCategory":"Best Performance by an Actor in a Limited Series, Anthology Series, or a Motion Picture Made for Television","sourceRecordId":71095,"work":{"mediaType":"movie","title":"Longford","releaseYear":2006,"tmdbId":36328,"imdbId":"tt0759612"},"people":[{"name":"Jim Broadbent","tmdbId":388}]}]}
