{"$schema":"../../../../schema/award-results.schema.json","schemaVersion":1,"awardBodyId":"bafta-television","ceremony":{"year":1993,"number":46},"source":{"name":"British Academy of Film and Television Arts","reference":"https://www.bafta.org/awards/television/","checkedAt":"2026-08-22"},"results":[{"categoryId":"television-leading-actor","status":"winner","sourceCategory":"Actor","sourceRecordId":347086,"work":{"mediaType":"series","title":"Inspector Morse","releaseYear":1987,"tmdbId":3476,"imdbId":"tt0092379"},"people":[{"name":"John Thaw","tmdbId":137924,"imdbId":"nm0857177"}]},{"categoryId":"television-leading-actress","status":"winner","sourceCategory":"Actress","sourceRecordId":347087,"work":{"mediaType":"series","title":"Prime Suspect","releaseYear":1991,"tmdbId":2583,"imdbId":"tt0098898"},"people":[{"name":"Helen Mirren","tmdbId":15735,"imdbId":"nm0000545"}]},{"categoryId":"television-childrens-non-scripted","status":"winner","sourceCategory":"Children's Programme - Factual","sourceRecordId":347091,"work":{"mediaType":"series","title":"Art Attack","releaseYear":1990,"tmdbId":1780,"imdbId":"tt0313033"},"people":[{"name":"Tim Edmunds"}]},{"categoryId":"television-childrens-scripted","status":"winner","sourceCategory":"Children's Programme - Fiction or Entertainment","sourceRecordId":347096,"work":{"mediaType":"series","title":"Archer's Goon","releaseYear":1992,"tmdbId":37184,"imdbId":"tt0315647"},"people":[{"name":"Richard Callanan"},{"name":"Marilyn Fox"},{"name":"Jenny McDade"}]},{"categoryId":"television-scripted-comedy","status":"winner","sourceCategory":"Comedy - Programme or Series","sourceRecordId":347101,"work":{"mediaType":"series","title":"Absolutely Fabulous","releaseYear":1992,"tmdbId":4493,"imdbId":"tt0105929"},"people":[{"name":"Jon Plowman"},{"name":"Bob Spiers"},{"name":"Jennifer Saunders","tmdbId":12094,"imdbId":"nm0766837"}]},{"categoryId":"television-limited-drama","status":"winner","sourceCategory":"Drama Serial","sourceRecordId":347105,"work":{"mediaType":"series","title":"Anglo Saxon Attitudes","releaseYear":1992,"tmdbId":17827,"imdbId":"tt0204136"},"people":[{"name":"Andrew Brown"},{"name":"Diarmuid Lawrence"},{"name":"Andrew Davies"}]},{"categoryId":"television-drama-series","status":"winner","sourceCategory":"Drama Series","sourceRecordId":347111,"work":{"mediaType":"series","title":"Inspector Morse","releaseYear":1987,"tmdbId":3476,"imdbId":"tt0092379"},"people":[{"name":"Deirdre Keir"}]},{"categoryId":"television-factual-series","status":"winner","sourceCategory":"Factual Series","sourceRecordId":347115,"work":{"mediaType":"series","title":"Pandora's Box","releaseYear":1992,"tmdbId":5877,"imdbId":"tt0437029"},"people":[{"name":"Adam Curtis"}]},{"categoryId":"television-single-documentary","status":"winner","sourceCategory":"Flaherty Documentary Award","sourceRecordId":347120,"work":{"mediaType":"series","title":"Video Diaries","releaseYear":1990,"tmdbId":47691,"imdbId":"tt0800978"},"people":[{"name":"Bob Long"},{"name":"Dr Yili Hasani"}]},{"categoryId":"television-international","status":"winner","sourceCategory":"Foreign Television Programme","sourceRecordId":347121,"work":{"mediaType":"movie","title":"Tosca: In the Settings and at the Times of Tosca","releaseYear":1993,"tmdbId":1103936,"imdbId":"tt0105625"},"people":[{"name":"Andrea Andermann"},{"name":"Brian Large"}]},{"categoryId":"television-specialist-factual","status":"winner","sourceCategory":"Huw Wheldon Award For The Best Arts Programme","sourceRecordId":347124,"work":{"mediaType":"series","title":"Omnibus","releaseYear":1967,"tmdbId":5674,"imdbId":"tt0200358"},"people":[{"name":"Kim Evans"}]},{"categoryId":"television-entertainment-performance","status":"winner","sourceCategory":"Light Entertainment Performance","sourceRecordId":347126,"work":{"mediaType":"series","title":"Absolutely Fabulous","releaseYear":1992,"tmdbId":4493,"imdbId":"tt0105929"},"people":[{"name":"Joanna Lumley","tmdbId":34901,"imdbId":"nm0525921"}]},{"categoryId":"television-entertainment","status":"winner","sourceCategory":"Light Entertainment","sourceRecordId":347132,"work":{"mediaType":"series","title":"Noel's House Party","releaseYear":1991,"tmdbId":2523,"imdbId":"tt0101155"},"people":[{"name":"Michael Leggo"}]},{"categoryId":"television-limited-drama","status":"winner","sourceCategory":"Single Drama","sourceRecordId":347146,"work":{"mediaType":"movie","title":"An Ungentlemanly Act","releaseYear":1992,"tmdbId":45562,"imdbId":"tt0134178"},"people":[{"name":"Bradley Adams"},{"name":"Stuart Urban"}]}]}
