{"$schema":"../../../../schema/award-results.schema.json","schemaVersion":1,"awardBodyId":"academy-awards","ceremony":{"year":1970,"number":42},"source":{"name":"Academy Awards Database","reference":"https://awardsdatabase.oscars.org/","checkedAt":"2026-08-20"},"results":[{"categoryId":"best-picture","status":"winner","work":{"mediaType":"movie","title":"Midnight Cowboy","imdbId":"tt0064665"}},{"categoryId":"best-actor","status":"winner","people":[{"name":"John Wayne","tmdbId":4165}],"work":{"mediaType":"movie","title":"True Grit","tmdbId":17529,"imdbId":"tt0065126","releaseYear":1969}},{"categoryId":"best-actress","status":"winner","people":[{"name":"Maggie Smith","tmdbId":10978}],"work":{"mediaType":"movie","title":"The Prime of Miss Jean Brodie","tmdbId":5179,"imdbId":"tt0064840","releaseYear":1969}},{"categoryId":"best-director","status":"winner","work":{"mediaType":"movie","title":"Midnight Cowboy","tmdbId":3116,"imdbId":"tt0064665","releaseYear":1969},"people":[{"name":"John Schlesinger","tmdbId":19304}]},{"categoryId":"best-supporting-actor","status":"winner","people":[{"name":"Gig Young","tmdbId":70985}],"work":{"mediaType":"movie","title":"They Shoot Horses, Don't They?","tmdbId":28145,"imdbId":"tt0065088","releaseYear":1969}},{"categoryId":"best-supporting-actress","status":"winner","people":[{"name":"Goldie Hawn","tmdbId":18892}],"work":{"mediaType":"movie","title":"Cactus Flower","tmdbId":28289,"imdbId":"tt0064117","releaseYear":1969}}]}
