{"$schema":"../../../../schema/award-results.schema.json","schemaVersion":1,"awardBodyId":"bafta-television-craft","ceremony":{"year":2024,"number":77},"source":{"name":"British Academy of Film and Television Arts","reference":"https://www.bafta.org/awards/tv-craft/","checkedAt":"2026-08-22"},"results":[{"categoryId":"television-craft-costume-design","status":"winner","sourceCategory":"Costume Design","sourceRecordId":361703,"work":{"mediaType":"series","title":"The Great","releaseYear":2020,"tmdbId":93812,"imdbId":"tt2235759"},"people":[{"name":"Sharon Long"}]},{"categoryId":"television-craft-director-factual","status":"winner","sourceCategory":"Director: Factual","sourceRecordId":361707,"work":{"mediaType":"movie","title":"Otto Baxter: Not a F***ing Horror Story","releaseYear":2023,"tmdbId":1141657,"imdbId":"tt23850840"},"people":[{"name":"Peter Beard","tmdbId":4117575},{"name":"Bruce Fletcher","tmdbId":2060153,"imdbId":"nm3094699"}]},{"categoryId":"television-craft-director-fiction","status":"winner","sourceCategory":"Director: Fiction","sourceRecordId":361710,"work":{"mediaType":"series","title":"The Last of Us","releaseYear":2023,"tmdbId":100088,"imdbId":"tt3581920"},"people":[{"name":"Peter Hoar","tmdbId":208453,"imdbId":"nm0387486"}]},{"categoryId":"television-craft-director-multi-camera","status":"winner","sourceCategory":"Director: Multi-Camera","sourceRecordId":361714,"work":{"mediaType":"series","title":"Eurovision Song Contest","releaseYear":1956,"tmdbId":28032,"imdbId":"tt0313343"},"people":[{"name":"Nikki Parsons"},{"name":"Ollie Bartlett"},{"name":"Richard Valentine","tmdbId":100512,"imdbId":"nm1064419"}]},{"categoryId":"television-craft-editing-factual","status":"winner","sourceCategory":"Editing: Factual","sourceRecordId":361717,"work":{"mediaType":"series","title":"Once Upon a Time in Northern Ireland","releaseYear":2023,"tmdbId":226328,"imdbId":"tt27837209"},"people":[{"name":"Editing Team"}]},{"categoryId":"television-craft-editing-fiction","status":"winner","sourceCategory":"Editing: Fiction","sourceRecordId":361722,"work":{"mediaType":"series","title":"Slow Horses","releaseYear":2022,"tmdbId":95480,"imdbId":"tt5875444"},"people":[{"name":"Sam Williams"}]},{"categoryId":"television-craft-emerging-talent-factual","status":"winner","sourceCategory":"Emerging Talent: Factual","sourceRecordId":361726,"work":{"mediaType":"movie","title":"London Bridge: Facing Terror","releaseYear":2023,"tmdbId":1169364,"imdbId":"tt31845164"},"people":[{"name":"Fred Scott"}]},{"categoryId":"television-craft-emerging-talent-fiction","status":"winner","sourceCategory":"Emerging Talent: Fiction","sourceRecordId":361730,"work":{"mediaType":"series","title":"Such Brave Girls","releaseYear":2023,"tmdbId":239614,"imdbId":"tt18974452"},"people":[{"name":"Kat Sadler"}]},{"categoryId":"television-craft-entertainment-craft-team","status":"winner","sourceCategory":"Entertainment Craft Team","sourceRecordId":361734,"work":{"mediaType":"series","title":"Eurovision Song Contest","releaseYear":1956,"tmdbId":28032,"imdbId":"tt0313343"},"people":[{"name":"Julio Himede"},{"name":"Tim Routledge"},{"name":"Kojo Samuel"},{"name":"Michael Sharp"},{"name":"Dan Shipton"}]},{"categoryId":"television-craft-make-up-hair-design","status":"winner","sourceCategory":"Make Up & Hair Design","sourceRecordId":361737,"work":{"mediaType":"series","title":"The Long Shadow","releaseYear":2023,"tmdbId":231811,"imdbId":"tt13323596"},"people":[{"name":"Lisa Parkinson"}]},{"categoryId":"television-craft-original-music-factual","status":"winner","sourceCategory":"Original Music: Factual","sourceRecordId":361743,"work":{"mediaType":"series","title":"Once Upon a Time in Northern Ireland","releaseYear":2023,"tmdbId":226328,"imdbId":"tt27837209"},"people":[{"name":"Simon Russell"}]},{"categoryId":"television-craft-original-music-fiction","status":"winner","sourceCategory":"Original Music: Fiction","sourceRecordId":361745,"work":{"mediaType":"series","title":"Silo","releaseYear":2023,"tmdbId":125988,"imdbId":"tt14688458"},"people":[{"name":"Atli Örvarsson"}]},{"categoryId":"television-craft-photography-factual","status":"winner","sourceCategory":"Photography: Factual","sourceRecordId":361748,"work":{"mediaType":"series","title":"The Detectives: Taking Down an OCG","releaseYear":2023,"tmdbId":238600,"imdbId":"tt31187266"},"people":[{"name":"Benedict Sanderson"}]},{"categoryId":"television-craft-photography-lighting-fiction","status":"winner","sourceCategory":"Photography & Lighting: Fiction","sourceRecordId":361755,"work":{"mediaType":"series","title":"Black Mirror","releaseYear":2011,"tmdbId":42009,"imdbId":"tt2085059"},"people":[{"name":"Stephan Pehrsson"}]},{"categoryId":"television-craft-production-design","status":"winner","sourceCategory":"Production Design","sourceRecordId":361758,"work":{"mediaType":"series","title":"Silo","releaseYear":2023,"tmdbId":125988,"imdbId":"tt14688458"},"people":[{"name":"Gavin Bocquet"},{"name":"Amanda Bernstein"}]},{"categoryId":"television-craft-scripted-casting","status":"winner","sourceCategory":"Scripted Casting","sourceRecordId":361760,"work":{"mediaType":"series","title":"Three Little Birds","releaseYear":2023,"tmdbId":237311,"imdbId":"tt13678006"},"people":[{"name":"Aisha Bywaters"}]},{"categoryId":"television-craft-sound-factual","status":"winner","sourceCategory":"Sound: Factual","sourceRecordId":361766,"work":{"mediaType":"movie","title":"The Coronation of TM King Charles III and Queen Camilla","releaseYear":2023,"tmdbId":1122056,"imdbId":"tt22736788"},"people":[{"name":"Sound Team"}]},{"categoryId":"television-craft-sound-fiction","status":"winner","sourceCategory":"Sound: Fiction","sourceRecordId":361771,"work":{"mediaType":"series","title":"Slow Horses","releaseYear":2022,"tmdbId":95480,"imdbId":"tt5875444"},"people":[{"name":"Sound Team"}]},{"categoryId":"television-craft-special-visual-graphic-effects","status":"winner","sourceCategory":"Special, Visual And Graphic Effects","sourceRecordId":361775,"work":{"mediaType":"series","title":"The Witcher","releaseYear":2019,"tmdbId":71912,"imdbId":"tt5180504"},"people":[{"name":"Tim Crosbie"},{"name":"Caimin Bourne"},{"name":"Jet Omoshebi"},{"name":"Dan Weir"},{"name":"Cinesite"},{"name":"David Stephens"}]},{"categoryId":"television-craft-titles-graphic-identity","status":"winner","sourceCategory":"Titles & Graphic Identity","sourceRecordId":361779,"work":{"mediaType":"series","title":"Wilderness","releaseYear":2023,"tmdbId":204276,"imdbId":"tt15426714"},"people":[{"name":"Tamsin McGee"},{"name":"Ben Hanbury"},{"name":"Hugo Moss"},{"name":"Paul McDonnell"}]},{"categoryId":"television-craft-writer-comedy","status":"winner","sourceCategory":"Writer: Comedy","sourceRecordId":361780,"work":{"mediaType":"series","title":"Big Boys","releaseYear":2022,"tmdbId":202851,"imdbId":"tt13683866"},"people":[{"name":"Jack Rooke"}]},{"categoryId":"television-craft-writer-drama","status":"winner","sourceCategory":"Writer: Drama","sourceRecordId":361784,"work":{"mediaType":"series","title":"Black Mirror","releaseYear":2011,"tmdbId":42009,"imdbId":"tt2085059"},"people":[{"name":"Charlie Brooker"},{"name":"Bisha K Ali"}]}]}
