{"$schema":"../../../../schema/award-results.schema.json","schemaVersion":1,"awardBodyId":"bafta-television-craft","ceremony":{"year":1982,"number":35},"source":{"name":"British Academy of Film and Television Arts","reference":"https://www.bafta.org/awards/tv-craft/","checkedAt":"2026-08-22"},"results":[{"categoryId":"television-craft-production-design","status":"winner","sourceCategory":"Design","sourceRecordId":346391,"work":{"mediaType":"series","title":"Brideshead Revisited","releaseYear":1981,"tmdbId":4951,"imdbId":"tt0083390"},"people":[{"name":"Peter Phillips"}]},{"categoryId":"television-craft-costume-design","status":"winner","sourceCategory":"Costume Design","sourceRecordId":348852,"work":{"mediaType":"series","title":"Brideshead Revisited","releaseYear":1981,"tmdbId":4951,"imdbId":"tt0083390"},"people":[{"name":"Jane Robinson"}]},{"categoryId":"television-craft-make-up-hair-design","status":"winner","sourceCategory":"Make Up & Hair Design","sourceRecordId":348875,"work":{"mediaType":"series","title":"Brideshead Revisited","releaseYear":1981,"tmdbId":4951,"imdbId":"tt0083390"},"people":[{"name":"Deborah Tinsey"},{"name":"Ruth Quinn"}]},{"categoryId":"television-craft-photography-lighting-fiction","status":"winner","sourceCategory":"Television Cameraman","sourceRecordId":348880,"works":[{"mediaType":"movie","title":"All's Well That Ends Well","releaseYear":1981,"tmdbId":106383,"imdbId":"tt0080352"},{"mediaType":"movie","title":"Othello","releaseYear":1981,"tmdbId":119928,"imdbId":"tt0082861"},{"mediaType":"movie","title":"Timon of Athens","releaseYear":1981,"tmdbId":119831,"imdbId":"tt0083207"},{"mediaType":"movie","title":"Troilus & Cressida","releaseYear":1981,"tmdbId":119913,"imdbId":"tt0083228"}],"people":[{"name":"Jim Atkinson"}]},{"categoryId":"television-craft-photography-lighting-fiction","status":"winner","sourceCategory":"Video Lighting","sourceRecordId":348886,"works":[{"mediaType":"movie","title":"The Cherry Orchard","releaseYear":1981,"tmdbId":120203,"imdbId":"tt0488991"},{"mediaType":"series","title":"Playhouse","releaseYear":1974,"tmdbId":30504,"imdbId":"tt0762803"}],"people":[{"name":"Howard King"}]}]}
