{"$schema":"../../../../schema/award-results.schema.json","schemaVersion":1,"awardBodyId":"bafta-film","ceremony":{"year":1976,"number":29},"source":{"name":"British Academy of Film and Television Arts","reference":"https://www.bafta.org/awards/film/","checkedAt":"2026-08-22"},"results":[{"categoryId":"film-leading-actor","status":"winner","sourceCategory":"Actor","sourceRecordId":341314,"works":[{"mediaType":"movie","title":"The Godfather Part II","releaseYear":1974,"tmdbId":240,"imdbId":"tt0071562"},{"mediaType":"movie","title":"Dog Day Afternoon","releaseYear":1975,"tmdbId":968,"imdbId":"tt0072890"}],"people":[{"name":"Al Pacino","tmdbId":1158,"imdbId":"nm0000199"}]},{"categoryId":"film-leading-actress","status":"winner","sourceCategory":"Actress","sourceRecordId":341316,"work":{"mediaType":"movie","title":"Alice Doesn't Live Here Anymore","releaseYear":1974,"tmdbId":16153,"imdbId":"tt0071115"},"people":[{"name":"Ellen Burstyn","tmdbId":9560,"imdbId":"nm0000995"}]},{"categoryId":"film-animated-film","status":"winner","sourceCategory":"Animated Film","sourceRecordId":341319,"work":{"mediaType":"movie","title":"Great (Isambard Kingdom Brunel)","releaseYear":1975,"imdbId":"tt0073068"},"people":[{"name":"Bob Godfrey"}]},{"categoryId":"film-original-score","status":"winner","sourceCategory":"Anthony Asquith Award for Original Film Music","sourceRecordId":341322,"works":[{"mediaType":"movie","title":"Jaws","releaseYear":1975,"tmdbId":578,"imdbId":"tt0073195"},{"mediaType":"movie","title":"The Towering Inferno","releaseYear":1974,"tmdbId":5919,"imdbId":"tt0072308"}],"people":[{"name":"John Williams"}]},{"categoryId":"film-production-design","status":"winner","sourceCategory":"Art Direction","sourceRecordId":341327,"work":{"mediaType":"movie","title":"Rollerball","releaseYear":1975,"tmdbId":11484,"imdbId":"tt0073631"},"people":[{"name":"John Box"}]},{"categoryId":"film-cinematography","status":"winner","sourceCategory":"Cinematography","sourceRecordId":341329,"work":{"mediaType":"movie","title":"Barry Lyndon","releaseYear":1975,"tmdbId":3175,"imdbId":"tt0072684"},"people":[{"name":"John Alcott"}]},{"categoryId":"film-costume-design","status":"winner","sourceCategory":"Costume Design","sourceRecordId":341334,"work":{"mediaType":"movie","title":"The Day of the Locust","releaseYear":1975,"tmdbId":5122,"imdbId":"tt0072848"},"people":[{"name":"Ann Roth"}]},{"categoryId":"film-director","status":"winner","sourceCategory":"Direction","sourceRecordId":341338,"work":{"mediaType":"movie","title":"Barry Lyndon","releaseYear":1975,"tmdbId":3175,"imdbId":"tt0072684"},"people":[{"name":"Stanley Kubrick","tmdbId":240,"imdbId":"nm0000040"}]},{"categoryId":"film-best-film","status":"winner","sourceCategory":"Film","sourceRecordId":341341,"work":{"mediaType":"movie","title":"Alice Doesn't Live Here Anymore","releaseYear":1974,"tmdbId":16153,"imdbId":"tt0071115"}},{"categoryId":"film-editing","status":"winner","sourceCategory":"Film Editing","sourceRecordId":341345,"work":{"mediaType":"movie","title":"Dog Day Afternoon","releaseYear":1975,"tmdbId":968,"imdbId":"tt0072890"},"people":[{"name":"Dede Allen"}]},{"categoryId":"film-documentary","status":"winner","sourceCategory":"Robert Flaherty Award (Feature Length Film, Documentary In Content)","sourceRecordId":341357,"work":{"mediaType":"movie","title":"The Early Americans","releaseYear":1975,"tmdbId":949437,"imdbId":"tt0215736"},"people":[{"name":"Alan Pendry"}]},{"categoryId":"film-sound","status":"winner","sourceCategory":"Soundtrack","sourceRecordId":341365,"work":{"mediaType":"movie","title":"Nashville","releaseYear":1975,"tmdbId":3121,"imdbId":"tt0073440"},"people":[{"name":"William A Sawyer"},{"name":"Jim Webb"},{"name":"Chris McLaughlin"},{"name":"Richard Portman"}]},{"categoryId":"film-supporting-actor","status":"winner","sourceCategory":"Supporting Actor","sourceRecordId":341370,"work":{"mediaType":"movie","title":"The Towering Inferno","releaseYear":1974,"tmdbId":5919,"imdbId":"tt0072308"},"people":[{"name":"Fred Astaire","tmdbId":30181,"imdbId":"nm0000001"}]},{"categoryId":"film-supporting-actress","status":"winner","sourceCategory":"Supporting Actress","sourceRecordId":341376,"work":{"mediaType":"movie","title":"Alice Doesn't Live Here Anymore","releaseYear":1974,"tmdbId":16153,"imdbId":"tt0071115"},"people":[{"name":"Diane Ladd","tmdbId":6587,"imdbId":"nm0002663"}]}]}
