{
  "$schema": "../../../../schema/award-results.schema.json",
  "schemaVersion": 1,
  "awardBodyId": "academy-awards",
  "ceremony": {
    "year": 2011,
    "number": 83
  },
  "source": {
    "name": "Academy Awards Database",
    "reference": "https://awardsdatabase.oscars.org/",
    "checkedAt": "2026-08-16"
  },
  "results": [
    {
      "categoryId": "best-picture",
      "status": "winner",
      "work": {
        "mediaType": "movie",
        "title": "The King's Speech",
        "imdbId": "tt1504320"
      }
    },
    {
      "categoryId": "best-actor",
      "status": "winner",
      "people": [
        {
          "name": "Colin Firth",
          "tmdbId": 5472
        }
      ],
      "work": {
        "mediaType": "movie",
        "title": "The King's Speech",
        "tmdbId": 45269,
        "imdbId": "tt1504320",
        "releaseYear": 2010
      }
    }
  ]
}
