{"$schema":"../../../../schema/award-results.schema.json","schemaVersion":1,"awardBodyId":"bafta-television-craft","ceremony":{"year":1976,"number":29},"source":{"name":"British Academy of Film and Television Arts","reference":"https://www.bafta.org/awards/tv-craft/","checkedAt":"2026-08-22"},"results":[{"categoryId":"television-craft-production-design","status":"winner","sourceCategory":"Design","sourceRecordId":345933,"work":{"mediaType":"series","title":"Edward the Seventh","releaseYear":1975,"tmdbId":13271,"imdbId":"tt0072925"},"people":[{"name":"Henry Graveney"},{"name":"Anthony Waller"}]}]}
