{"$schema":"../../../../schema/award-results.schema.json","schemaVersion":1,"awardBodyId":"bafta-television","ceremony":{"year":1970,"number":23},"source":{"name":"British Academy of Film and Television Arts","reference":"https://www.bafta.org/awards/television/","checkedAt":"2026-08-22"},"results":[{"categoryId":"television-leading-actor","status":"winner","sourceCategory":"Actor","sourceRecordId":345632,"works":[{"mediaType":"series","title":"Callan","releaseYear":1967,"tmdbId":4371,"imdbId":"tt0061238"},{"mediaType":"series","title":"Omnibus","releaseYear":1967,"tmdbId":5674,"imdbId":"tt0200358"},{"mediaType":"series","title":"The Root of All Evil?","releaseYear":1968,"imdbId":"tt1346933"}],"people":[{"name":"Edward Woodward","tmdbId":39188,"imdbId":"nm0940919"}]},{"categoryId":"television-leading-actress","status":"winner","sourceCategory":"Actress","sourceRecordId":345635,"work":{"mediaType":"series","title":"The First Churchills","releaseYear":1969,"tmdbId":13814,"imdbId":"tt0065292"},"people":[{"name":"Margaret Tyzack","tmdbId":250,"imdbId":"nm0879239"}]},{"categoryId":"television-drama-series","status":"winner","sourceCategory":"Drama Series","sourceRecordId":345646,"work":{"mediaType":"series","title":"W. Somerset Maugham","releaseYear":1969,"tmdbId":45772,"imdbId":"tt0958966"},"people":[{"name":"Verity Lambert"}]},{"categoryId":"television-single-documentary","status":"winner","sourceCategory":"Factual: Documentary","sourceRecordId":345650,"work":{"mediaType":"series","title":"A Year in the Life","releaseYear":1969,"imdbId":"tt43277628"},"people":[{"name":"Paul Watson"}]},{"categoryId":"television-current-affairs","status":"winner","sourceCategory":"Factual: Current Affairs","sourceRecordId":345653,"work":{"mediaType":"series","title":"News at Ten","releaseYear":1967,"imdbId":"tt0229912"},"people":[{"name":"Production Team"}]},{"categoryId":"television-international","status":"winner","sourceCategory":"Foreign Television Programme","sourceRecordId":345654,"work":{"mediaType":"series","title":"The First Television Pictures From The Moon"},"people":[{"name":"Neil Armstrong And Everyone Associated"}],"note":"The First Television Pictures From The Moon is preserved as TMDB series 48039, but the reviewed record has no IMDb relationship and no compatible alternative identity was found."},{"categoryId":"television-entertainment","status":"winner","sourceCategory":"Light Entertainment","sourceRecordId":345658,"work":{"mediaType":"movie","title":"Just Pet (Musical)"},"people":[{"name":"Yvonne Littlewood"}],"note":"The 1969 BBC Petula Clark special Just Pet (Musical) is verified by BAFTA, but review found no compatible IMDb identity; unrelated US Petula specials must not be substituted."},{"categoryId":"television-entertainment","status":"winner","sourceCategory":"Light Entertainment","sourceRecordId":345661,"work":{"mediaType":"series","title":"Please Sir!","releaseYear":1968,"tmdbId":10005,"imdbId":"tt0063941"},"people":[{"name":"Mark Stuart"}]},{"categoryId":"television-specialist-factual","status":"winner","sourceCategory":"Specialised Programme","sourceRecordId":345677,"work":{"mediaType":"series","title":"Blue Peter","releaseYear":1958,"tmdbId":548,"imdbId":"tt0051257"},"people":[{"name":"Biddy Baxter"},{"name":"Edward Barnes"},{"name":"Rosemary Gill"}]},{"categoryId":"television-specialist-factual","status":"winner","sourceCategory":"Specialised Programme","sourceRecordId":345679,"work":{"mediaType":"movie","title":"Girls Wanted, Istanbul","releaseYear":1969,"imdbId":"tt32189654"},"people":[{"name":"Wendy Toye"}]},{"categoryId":"television-specialist-factual","status":"winner","sourceCategory":"Specialised Programme","sourceRecordId":345682,"work":{"mediaType":"series","title":"Omnibus","releaseYear":1967,"tmdbId":5674,"imdbId":"tt0200358"},"people":[{"name":"Fred Burnley"}]}]}
